{
  "metadata": {
    "version": 4.6,
    "type": "Object",
    "generator": "GalaxyQuest Faction 3D Gen"
  },
  "modelId": "faction_lit_reference",
  "label": "Faction Lit Reference",
  "version": 1,
  "scale": 1,
  "lod": {
    "segments_full": 24,
    "segments_low": 12
  },
  "images": [
    {
      "uuid": "img_panel_grid",
      "url": "models/textures/panel_grid.svg"
    },
    {
      "uuid": "img_emissive_lines",
      "url": "models/textures/emissive_lines.svg"
    }
  ],
  "textures": [
    {
      "uuid": "tex_panel_grid",
      "image": "img_panel_grid",
      "name": "panel-grid",
      "wrap": [
        1000,
        1000
      ],
      "repeat": [
        2,
        1
      ]
    },
    {
      "uuid": "tex_emissive_lines",
      "image": "img_emissive_lines",
      "name": "emissive-lines",
      "wrap": [
        1000,
        1000
      ],
      "repeat": [
        3,
        1
      ]
    },
    {
      "uuid": "tex_bump_grid",
      "image": "img_panel_grid",
      "name": "bump-grid",
      "wrap": [
        1000,
        1000
      ],
      "repeat": [
        4,
        2
      ]
    }
  ],
  "geometries": [
    {
      "uuid": "geo_hull_1",
      "type": "CylinderGeometry",
      "radiusTop": 0.45,
      "radiusBottom": 0.7,
      "height": 2.6,
      "radialSegments": 12
    },
    {
      "uuid": "geo_ring_1",
      "type": "TorusGeometry",
      "radius": 1.25,
      "tube": 0.12,
      "radialSegments": 10,
      "tubularSegments": 24
    },
    {
      "uuid": "geo_core_1",
      "type": "SphereGeometry",
      "radius": 0.22,
      "widthSegments": 10,
      "heightSegments": 8
    }
  ],
  "materials": [
    {
      "uuid": "mat_hull_1",
      "type": "MeshPhongMaterial",
      "color": 4410440,
      "emissive": 1116748,
      "specular": 11184810,
      "shininess": 72,
      "map": "tex_panel_grid",
      "bumpMap": "tex_bump_grid",
      "bumpScale": 0.2,
      "specularMap": "tex_emissive_lines",
      "normalMap": "tex_bump_grid",
      "normalScale": [
        0.7,
        0.7
      ]
    },
    {
      "uuid": "mat_ring_1",
      "type": "MeshStandardMaterial",
      "color": 7833753,
      "emissive": 3368652,
      "emissiveIntensity": 0.65,
      "metalness": 0.7,
      "roughness": 0.3,
      "emissiveMap": "tex_emissive_lines",
      "roughnessMap": "tex_panel_grid",
      "metalnessMap": "tex_panel_grid"
    },
    {
      "uuid": "mat_core_1",
      "type": "MeshStandardMaterial",
      "color": 16756736,
      "emissive": 16742912,
      "emissiveIntensity": 1.4,
      "metalness": 0.45,
      "roughness": 0.15
    }
  ],
  "animations": [
    {
      "name": "idle_ring_spin",
      "duration": 6,
      "tracks": [
        {
          "name": "mesh_ring_1.rotation[y]",
          "type": "number",
          "times": [
            0,
            6
          ],
          "values": [
            0,
            6.2831853072
          ],
          "interpolation": 2301
        }
      ]
    },
    {
      "name": "active_core_pulse",
      "duration": 2,
      "tracks": [
        {
          "name": "mesh_core_1.scale[x]",
          "type": "number",
          "times": [
            0,
            1,
            2
          ],
          "values": [
            1,
            1.25,
            1
          ],
          "interpolation": 2301
        },
        {
          "name": "mesh_core_1.scale[y]",
          "type": "number",
          "times": [
            0,
            1,
            2
          ],
          "values": [
            1,
            1.25,
            1
          ],
          "interpolation": 2301
        },
        {
          "name": "mesh_core_1.scale[z]",
          "type": "number",
          "times": [
            0,
            1,
            2
          ],
          "values": [
            1,
            1.25,
            1
          ],
          "interpolation": 2301
        }
      ]
    },
    {
      "name": "alert_beacon_boost",
      "duration": 1.6,
      "tracks": [
        {
          "name": "light_beacon_1.intensity",
          "type": "number",
          "times": [
            0,
            0.8,
            1.6
          ],
          "values": [
            1.5,
            4.5,
            1.5
          ],
          "interpolation": 2301
        }
      ]
    }
  ],
  "object": {
    "uuid": "obj_root",
    "type": "Group",
    "name": "faction_lit_reference",
    "userData": {
      "gqModelSemantics": {
        "factionCode": "helion_confederation",
        "objectClass": "relay_or_sensor",
        "archetype": "lit_reference",
        "designLanguageVersion": "egl-1.0",
        "silhouetteTags": [
          "modular_tradeframe",
          "beacon_ring"
        ],
        "signatureParts": [
          "trade_rings",
          "docking_braids"
        ]
      },
      "designIntent": "Referenz fuer Materialmaps plus lokales Signaturlicht.",
      "recognitionHints": [
        "beacon",
        "panel",
        "specular"
      ],
      "gqAnimations": [],
      "gqVfxEmitters": [
        {
          "id": "thruster_main",
          "kind": "thruster",
          "mode": "continuous",
          "attachTo": "mesh_core_1",
          "position": [
            0,
            0,
            -0.35
          ],
          "direction": [
            0,
            0,
            -1
          ],
          "count": 24,
          "lifetime": 0.45,
          "speed": 7.5,
          "spread": 0.22,
          "colorStart": 16763904,
          "colorEnd": 3368703,
          "sizeStart": 0.14,
          "sizeEnd": 0.03,
          "drag": 0.05
        },
        {
          "id": "muzzle_primary",
          "kind": "muzzle",
          "mode": "burst",
          "attachTo": "mesh_ring_1",
          "position": [
            0,
            0,
            1.05
          ],
          "direction": [
            0,
            0,
            1
          ],
          "count": 18,
          "lifetime": 0.22,
          "speed": 14,
          "spread": 0.16,
          "colorStart": 16766976,
          "colorEnd": 16724787,
          "sizeStart": 0.11,
          "sizeEnd": 0.01,
          "drag": 0.02
        }
      ],
      "gqWeaponFx": [
        {
          "id": "beam_primary",
          "kind": "beam",
          "from": "muzzle_primary",
          "to": "target",
          "coreColor": 16724787,
          "glowColor": 8965375,
          "glowRadius": 0.18,
          "alpha": 0.9
        }
      ]
    },
    "children": [
      {
        "uuid": "mesh_hull_1",
        "type": "Mesh",
        "name": "mesh_hull_1",
        "geometry": "geo_hull_1",
        "material": "mat_hull_1",
        "rotation": [
          1.5708,
          0,
          0
        ],
        "userData": {
          "role": "hull"
        }
      },
      {
        "uuid": "mesh_ring_1",
        "type": "Mesh",
        "name": "mesh_ring_1",
        "geometry": "geo_ring_1",
        "material": "mat_ring_1",
        "rotation": [
          1.5708,
          0,
          0
        ],
        "userData": {
          "role": "beacon-ring"
        }
      },
      {
        "uuid": "mesh_core_1",
        "type": "Mesh",
        "name": "mesh_core_1",
        "geometry": "geo_core_1",
        "material": "mat_core_1",
        "position": [
          0,
          0.05,
          0
        ],
        "userData": {
          "role": "core"
        }
      },
      {
        "uuid": "light_beacon_1",
        "type": "PointLight",
        "name": "light_beacon_1",
        "color": 16756736,
        "intensity": 1.5,
        "distance": 7,
        "decay": 2,
        "position": [
          0,
          0.1,
          0
        ]
      },
      {
        "uuid": "mesh_muzzle_primary",
        "type": "Mesh",
        "name": "muzzle_primary",
        "geometry": "geo_core_1",
        "material": "mat_core_1",
        "position": [
          0,
          0,
          1.05
        ],
        "scale": [
          0.2,
          0.2,
          0.2
        ],
        "userData": {
          "role": "muzzle"
        }
      }
    ]
  }
}
